[
  {"id": "gold_076", "text": "هو كَتَبَ", "annotations": {"tokens": [{"text": "هو", "normalized": "هو", "start": 0, "end": 2}, {"text": "كَتَبَ", "normalized": "كتب", "start": 3, "end": 8, "root": ["ك","ت","ب"], "pattern": "فَعَلَ", "event_type": "ACTION"}]}, "annotator": "manual", "notes": "ضمير منفصل — هو"},
  {"id": "gold_077", "text": "هي عَلِمَتْ", "annotations": {"tokens": [{"text": "هي", "normalized": "هي", "start": 0, "end": 2}, {"text": "عَلِمَتْ", "normalized": "علمت", "start": 3, "end": 9, "root": ["ع","ل","م"], "pattern": "فَعِلَ", "event_type": "STATE"}]}, "annotator": "manual", "notes": "ضمير منفصل مؤنث — هي"},
  {"id": "gold_078", "text": "هذا كتابٌ", "annotations": {"tokens": [{"text": "هذا", "normalized": "هذا", "start": 0, "end": 3}, {"text": "كتابٌ", "normalized": "كتاب", "start": 4, "end": 8, "root": ["ك","ت","ب"]}]}, "annotator": "manual", "notes": "اسم إشارة — هذا"},
  {"id": "gold_079", "text": "الذي كَتَبَ", "annotations": {"tokens": [{"text": "الذي", "normalized": "الذي", "start": 0, "end": 4}, {"text": "كَتَبَ", "normalized": "كتب", "start": 5, "end": 10, "root": ["ك","ت","ب"], "pattern": "فَعَلَ", "event_type": "ACTION"}]}, "annotator": "manual", "notes": "اسم موصول — الذي"},
  {"id": "gold_080", "text": "أنت تَكتُبُ", "annotations": {"tokens": [{"text": "أنت", "normalized": "انت", "start": 0, "end": 3}, {"text": "تَكتُبُ", "normalized": "تكتب", "start": 4, "end": 10, "root": ["ك","ت","ب"]}]}, "annotator": "manual", "notes": "ضمير مخاطب — أنت"},
  {"id": "gold_081", "text": "نحن كَتَبنا", "annotations": {"tokens": [{"text": "نحن", "normalized": "نحن", "start": 0, "end": 3}, {"text": "كَتَبنا", "normalized": "كتبنا", "start": 4, "end": 10, "root": ["ك","ت","ب"]}]}, "annotator": "manual", "notes": "ضمير جمع متكلم — نحن"},
  {"id": "gold_082", "text": "هؤلاء طلابٌ", "annotations": {"tokens": [{"text": "هؤلاء", "normalized": "هولاء", "start": 0, "end": 5}, {"text": "طلابٌ", "normalized": "طلاب", "start": 6, "end": 10, "root": ["ط","ل","ب"]}]}, "annotator": "manual", "notes": "اسم إشارة للجمع — هؤلاء"},
  {"id": "gold_083", "text": "ذلك الكتابُ", "annotations": {"tokens": [{"text": "ذلك", "normalized": "ذلك", "start": 0, "end": 3}, {"text": "الكتابُ", "normalized": "الكتاب", "start": 4, "end": 11, "root": ["ك","ت","ب"]}]}, "annotator": "manual", "notes": "اسم إشارة للبعيد — ذلك"},
  {"id": "gold_084", "text": "التي كَتَبَتْ", "annotations": {"tokens": [{"text": "التي", "normalized": "التي", "start": 0, "end": 4}, {"text": "كَتَبَتْ", "normalized": "كتبت", "start": 5, "end": 12, "root": ["ك","ت","ب"], "pattern": "فَعَلَ", "event_type": "ACTION"}]}, "annotator": "manual", "notes": "اسم موصول مؤنث — التي"},
  {"id": "gold_085", "text": "هم كَتَبوا", "annotations": {"tokens": [{"text": "هم", "normalized": "هم", "start": 0, "end": 2}, {"text": "كَتَبوا", "normalized": "كتبوا", "start": 3, "end": 9, "root": ["ك","ت","ب"]}]}, "annotator": "manual", "notes": "ضمير جمع غائب — هم"}
]
