[
  {"id": "gold_066", "text": "كَتَبَ", "annotations": {"tokens": [{"text": "كَتَبَ", "normalized": "كتب", "start": 0, "end": 5, "root": ["ك","ت","ب"], "pattern": "فَعَلَ", "event_type": "ACTION"}], "classification": {"type": "خبر", "strength": "قطعي"}}, "annotator": "manual", "notes": "مطابقة: الفعل يدل على الكتابة مباشرة"},
  {"id": "gold_067", "text": "كَتَبَ الطالبُ", "annotations": {"tokens": [{"text": "كَتَبَ", "normalized": "كتب", "start": 0, "end": 5, "root": ["ك","ت","ب"], "pattern": "فَعَلَ", "event_type": "ACTION"}, {"text": "الطالبُ", "normalized": "الطالب", "start": 6, "end": 13}], "classification": {"type": "خبر", "strength": "قطعي"}}, "annotator": "manual", "notes": "تضمّن: يتضمن حركة + أداة + نية"},
  {"id": "gold_068", "text": "عَلِمَ المعلمُ", "annotations": {"tokens": [{"text": "عَلِمَ", "normalized": "علم", "start": 0, "end": 5, "root": ["ع","ل","م"], "pattern": "فَعِلَ", "event_type": "STATE"}, {"text": "المعلمُ", "normalized": "المعلم", "start": 6, "end": 13}], "classification": {"type": "خبر", "strength": "قطعي"}}, "annotator": "manual", "notes": "مطابقة: العلم يدل على المعرفة"},
  {"id": "gold_069", "text": "قَالَ الصدقَ", "annotations": {"tokens": [{"text": "قَالَ", "normalized": "قال", "start": 0, "end": 4, "root": ["ق","و","ل"], "pattern": "فَعَلَ", "event_type": "ACTION"}, {"text": "الصدقَ", "normalized": "الصدق", "start": 5, "end": 10}], "classification": {"type": "خبر", "strength": "قطعي"}}, "annotator": "manual", "notes": "التزام: القول يستلزم الصدق أو الكذب"},
  {"id": "gold_070", "text": "فَتَحَ البابَ", "annotations": {"tokens": [{"text": "فَتَحَ", "normalized": "فتح", "start": 0, "end": 5, "root": ["ف","ت","ح"], "pattern": "فَعَلَ", "event_type": "ACTION"}, {"text": "البابَ", "normalized": "الباب", "start": 6, "end": 11}], "classification": {"type": "خبر", "strength": "قطعي"}}, "annotator": "manual", "notes": "مطابقة + تضمّن: حركة فتح + أداة + مادة"},
  {"id": "gold_071", "text": "ضَرَبَ مثلاً", "annotations": {"tokens": [{"text": "ضَرَبَ", "normalized": "ضرب", "start": 0, "end": 5, "root": ["ض","ر","ب"], "pattern": "فَعَلَ", "event_type": "ACTION"}, {"text": "مثلاً", "normalized": "مثلا", "start": 6, "end": 11}], "classification": {"type": "خبر", "strength": "قطعي"}}, "annotator": "manual", "notes": "مجاز: ضرب المثل ليس ضربًا حسيًا — تضمّن مجازي"},
  {"id": "gold_072", "text": "حَكَمَ بالعدلِ", "annotations": {"tokens": [{"text": "حَكَمَ", "normalized": "حكم", "start": 0, "end": 5, "root": ["ح","ك","م"], "pattern": "فَعَلَ", "event_type": "ACTION"}, {"text": "بالعدلِ", "normalized": "بالعدل", "start": 6, "end": 12}], "classification": {"type": "خبر", "strength": "قطعي"}}, "annotator": "manual", "notes": "التزام: الحكم يستلزم العدل أو الجور"},
  {"id": "gold_073", "text": "سَمِعَ الخبرَ", "annotations": {"tokens": [{"text": "سَمِعَ", "normalized": "سمع", "start": 0, "end": 5, "root": ["س","م","ع"], "pattern": "فَعِلَ", "event_type": "STATE"}, {"text": "الخبرَ", "normalized": "الخبر", "start": 6, "end": 11}], "classification": {"type": "خبر", "strength": "قطعي"}}, "annotator": "manual", "notes": "مطابقة: السماع إدراك حسي مباشر"},
  {"id": "gold_074", "text": "نَصَرَ الحقَّ", "annotations": {"tokens": [{"text": "نَصَرَ", "normalized": "نصر", "start": 0, "end": 5, "root": ["ن","ص","ر"], "pattern": "فَعَلَ", "event_type": "ACTION"}, {"text": "الحقَّ", "normalized": "الحق", "start": 6, "end": 11}], "classification": {"type": "خبر", "strength": "قطعي"}}, "annotator": "manual", "notes": "تضمّن: النصر يتضمن قوة + إرادة + فعل"},
  {"id": "gold_075", "text": "أَكَلَ الطعامَ", "annotations": {"tokens": [{"text": "أَكَلَ", "normalized": "اكل", "start": 0, "end": 5, "root": ["ا","ك","ل"], "pattern": "فَعَلَ", "event_type": "ACTION"}, {"text": "الطعامَ", "normalized": "الطعام", "start": 6, "end": 12}], "classification": {"type": "خبر", "strength": "قطعي"}}, "annotator": "manual", "notes": "مطابقة + تضمّن: الأكل حدث حسي + استهلاك"}
]
