[
  {"id": "gold_036", "text": "كتب", "annotations": {"tokens": [{"text": "كتب", "normalized": "كتب", "start": 0, "end": 3, "root": ["ك","ت","ب"], "pattern": "فَعَلَ", "event_type": "ACTION"}]}, "annotator": "manual", "notes": "Root ك-ت-ب verb"},
  {"id": "gold_037", "text": "كتاب", "annotations": {"tokens": [{"text": "كتاب", "normalized": "كتاب", "start": 0, "end": 4, "root": ["ك","ت","ب"], "pattern": "فِعَال"}]}, "annotator": "manual", "notes": "Root ك-ت-ب noun"},
  {"id": "gold_038", "text": "ذهب", "annotations": {"tokens": [{"text": "ذهب", "normalized": "ذهب", "start": 0, "end": 3, "root": ["ذ","ه","ب"], "pattern": "فَعَلَ", "event_type": "ACTION"}]}, "annotator": "manual", "notes": "Root ذ-ه-ب verb"},
  {"id": "gold_039", "text": "جلس", "annotations": {"tokens": [{"text": "جلس", "normalized": "جلس", "start": 0, "end": 3, "root": ["ج","ل","س"], "pattern": "فَعَلَ", "event_type": "ACTION"}]}, "annotator": "manual", "notes": "Root ج-ل-س verb"},
  {"id": "gold_040", "text": "فتح", "annotations": {"tokens": [{"text": "فتح", "normalized": "فتح", "start": 0, "end": 3, "root": ["ف","ت","ح"], "pattern": "فَعَلَ", "event_type": "ACTION"}]}, "annotator": "manual", "notes": "Root ف-ت-ح verb"},
  {"id": "gold_041", "text": "سمع", "annotations": {"tokens": [{"text": "سمع", "normalized": "سمع", "start": 0, "end": 3, "root": ["س","م","ع"], "pattern": "فَعِلَ", "event_type": "STATE"}]}, "annotator": "manual", "notes": "Root س-م-ع verb"},
  {"id": "gold_042", "text": "علم", "annotations": {"tokens": [{"text": "علم", "normalized": "علم", "start": 0, "end": 3, "root": ["ع","ل","م"], "pattern": "فَعِلَ", "event_type": "STATE"}]}, "annotator": "manual", "notes": "Root ع-ل-م verb"},
  {"id": "gold_043", "text": "نصر", "annotations": {"tokens": [{"text": "نصر", "normalized": "نصر", "start": 0, "end": 3, "root": ["ن","ص","ر"], "pattern": "فَعَلَ", "event_type": "ACTION"}]}, "annotator": "manual", "notes": "Root ن-ص-ر verb"},
  {"id": "gold_044", "text": "دخل", "annotations": {"tokens": [{"text": "دخل", "normalized": "دخل", "start": 0, "end": 3, "root": ["د","خ","ل"], "pattern": "فَعَلَ", "event_type": "ACTION"}]}, "annotator": "manual", "notes": "Root د-خ-ل verb"},
  {"id": "gold_045", "text": "خرج", "annotations": {"tokens": [{"text": "خرج", "normalized": "خرج", "start": 0, "end": 3, "root": ["خ","ر","ج"], "pattern": "فَعَلَ", "event_type": "ACTION"}]}, "annotator": "manual", "notes": "Root خ-ر-ج verb"},
  {"id": "gold_046", "text": "حكم", "annotations": {"tokens": [{"text": "حكم", "normalized": "حكم", "start": 0, "end": 3, "root": ["ح","ك","م"], "pattern": "فَعَلَ", "event_type": "ACTION"}]}, "annotator": "manual", "notes": "Root ح-ك-م verb"},
  {"id": "gold_047", "text": "قال", "annotations": {"tokens": [{"text": "قال", "normalized": "قال", "start": 0, "end": 3, "root": ["ق","و","ل"], "pattern": "فَعَلَ", "event_type": "ACTION"}]}, "annotator": "manual", "notes": "Root ق-و-ل hollow verb"},
  {"id": "gold_048", "text": "عمل", "annotations": {"tokens": [{"text": "عمل", "normalized": "عمل", "start": 0, "end": 3, "root": ["ع","م","ل"], "pattern": "فَعِلَ", "event_type": "ACTION"}]}, "annotator": "manual", "notes": "Root ع-م-ل verb"},
  {"id": "gold_049", "text": "ضرب", "annotations": {"tokens": [{"text": "ضرب", "normalized": "ضرب", "start": 0, "end": 3, "root": ["ض","ر","ب"], "pattern": "فَعَلَ", "event_type": "ACTION"}]}, "annotator": "manual", "notes": "Root ض-ر-ب verb"},
  {"id": "gold_050", "text": "نظر", "annotations": {"tokens": [{"text": "نظر", "normalized": "نظر", "start": 0, "end": 3, "root": ["ن","ظ","ر"], "pattern": "فَعَلَ", "event_type": "ACTION"}]}, "annotator": "manual", "notes": "Root ن-ظ-ر verb"},
  {"id": "gold_051", "text": "شرب", "annotations": {"tokens": [{"text": "شرب", "normalized": "شرب", "start": 0, "end": 3, "root": ["ش","ر","ب"], "pattern": "فَعِلَ", "event_type": "ACTION"}]}, "annotator": "manual", "notes": "Root ش-ر-ب verb"},
  {"id": "gold_052", "text": "طلب", "annotations": {"tokens": [{"text": "طلب", "normalized": "طلب", "start": 0, "end": 3, "root": ["ط","ل","ب"], "pattern": "فَعَلَ", "event_type": "ACTION"}]}, "annotator": "manual", "notes": "Root ط-ل-ب verb"},
  {"id": "gold_053", "text": "درس", "annotations": {"tokens": [{"text": "درس", "normalized": "درس", "start": 0, "end": 3, "root": ["د","ر","س"], "pattern": "فَعَلَ", "event_type": "ACTION"}]}, "annotator": "manual", "notes": "Root د-ر-س verb"},
  {"id": "gold_054", "text": "حمد", "annotations": {"tokens": [{"text": "حمد", "normalized": "حمد", "start": 0, "end": 3, "root": ["ح","م","د"], "pattern": "فَعِلَ", "event_type": "STATE"}]}, "annotator": "manual", "notes": "Root ح-م-د verb"},
  {"id": "gold_055", "text": "رحم", "annotations": {"tokens": [{"text": "رحم", "normalized": "رحم", "start": 0, "end": 3, "root": ["ر","ح","م"], "pattern": "فَعِلَ", "event_type": "STATE"}]}, "annotator": "manual", "notes": "Root ر-ح-م verb"},
  {"id": "gold_056", "text": "ملك", "annotations": {"tokens": [{"text": "ملك", "normalized": "ملك", "start": 0, "end": 3, "root": ["م","ل","ك"], "pattern": "فَعَلَ", "event_type": "STATE"}]}, "annotator": "manual", "notes": "Root م-ل-ك verb"},
  {"id": "gold_057", "text": "عبد", "annotations": {"tokens": [{"text": "عبد", "normalized": "عبد", "start": 0, "end": 3, "root": ["ع","ب","د"], "pattern": "فَعَلَ", "event_type": "ACTION"}]}, "annotator": "manual", "notes": "Root ع-ب-د verb"},
  {"id": "gold_058", "text": "فعل", "annotations": {"tokens": [{"text": "فعل", "normalized": "فعل", "start": 0, "end": 3, "root": ["ف","ع","ل"], "pattern": "فَعَلَ", "event_type": "ACTION"}]}, "annotator": "manual", "notes": "Root ف-ع-ل verb — meta root"},
  {"id": "gold_059", "text": "وجد", "annotations": {"tokens": [{"text": "وجد", "normalized": "وجد", "start": 0, "end": 3, "root": ["و","ج","د"], "pattern": "فَعَلَ", "event_type": "STATE"}]}, "annotator": "manual", "notes": "Root و-ج-د verb"},
  {"id": "gold_060", "text": "امر", "annotations": {"tokens": [{"text": "امر", "normalized": "امر", "start": 0, "end": 3, "root": ["ا","م","ر"], "pattern": "فَعَلَ", "event_type": "ACTION"}]}, "annotator": "manual", "notes": "Root ا-م-ر verb"},
  {"id": "gold_061", "text": "كاتب", "annotations": {"tokens": [{"text": "كاتب", "normalized": "كاتب", "start": 0, "end": 4, "root": ["ك","ت","ب"], "pattern": "فَاعِل"}]}, "annotator": "manual", "notes": "Active participle from ك-ت-ب"},
  {"id": "gold_062", "text": "مكتوب", "annotations": {"tokens": [{"text": "مكتوب", "normalized": "مكتوب", "start": 0, "end": 5, "root": ["ك","ت","ب"], "pattern": "مَفْعُول"}]}, "annotator": "manual", "notes": "Passive participle from ك-ت-ب"},
  {"id": "gold_063", "text": "كتابة", "annotations": {"tokens": [{"text": "كتابة", "normalized": "كتابه", "start": 0, "end": 5, "root": ["ك","ت","ب"], "pattern": "فِعَالَة"}]}, "annotator": "manual", "notes": "Masdar from ك-ت-ب"},
  {"id": "gold_064", "text": "مكتب", "annotations": {"tokens": [{"text": "مكتب", "normalized": "مكتب", "start": 0, "end": 4, "root": ["ك","ت","ب"], "pattern": "مَفْعَل"}]}, "annotator": "manual", "notes": "Place noun from ك-ت-ب"},
  {"id": "gold_065", "text": "مكتبة", "annotations": {"tokens": [{"text": "مكتبة", "normalized": "مكتبه", "start": 0, "end": 5, "root": ["ك","ت","ب"]}]}, "annotator": "manual", "notes": "Library — derived from ك-ت-ب"}
]
