[
  {"id": "gold_086", "text": "كَتَبَ الطالبُ", "annotations": {"tokens": [{"text": "كَتَبَ", "normalized": "كتب", "start": 0, "end": 5, "root": ["ك","ت","ب"], "pattern": "فَعَلَ", "event_type": "ACTION"}, {"text": "الطالبُ", "normalized": "الطالب", "start": 6, "end": 13}], "classification": {"type": "خبر", "strength": "قطعي"}}, "annotator": "manual", "notes": "خبر قطعي — حكم وجودي"},
  {"id": "gold_087", "text": "هل كَتَبَ", "annotations": {"tokens": [{"text": "هل", "normalized": "هل", "start": 0, "end": 2}, {"text": "كَتَبَ", "normalized": "كتب", "start": 3, "end": 8, "root": ["ك","ت","ب"], "pattern": "فَعَلَ", "event_type": "ACTION"}], "classification": {"type": "إنشاء", "strength": "قطعي"}}, "annotator": "manual", "notes": "إنشاء — استفهام بهل"},
  {"id": "gold_088", "text": "اكتبْ", "annotations": {"tokens": [{"text": "اكتبْ", "normalized": "اكتب", "start": 0, "end": 5, "root": ["ك","ت","ب"]}], "classification": {"type": "إنشاء", "strength": "قطعي"}}, "annotator": "manual", "notes": "إنشاء — أمر"},
  {"id": "gold_089", "text": "الحمدُ للهِ", "annotations": {"tokens": [{"text": "الحمدُ", "normalized": "الحمد", "start": 0, "end": 5, "root": ["ح","م","د"]}, {"text": "للهِ", "normalized": "لله", "start": 6, "end": 9}], "classification": {"type": "خبر", "strength": "قطعي"}}, "annotator": "manual", "notes": "خبر — جملة اسمية"},
  {"id": "gold_090", "text": "الصدقُ حقٌّ", "annotations": {"tokens": [{"text": "الصدقُ", "normalized": "الصدق", "start": 0, "end": 5}, {"text": "حقٌّ", "normalized": "حق", "start": 6, "end": 9}], "classification": {"type": "خبر", "strength": "قطعي"}}, "annotator": "manual", "notes": "خبر — حكم على الماهية (حق/باطل)"},
  {"id": "gold_091", "text": "قد يكتبُ", "annotations": {"tokens": [{"text": "قد", "normalized": "قد", "start": 0, "end": 2}, {"text": "يكتبُ", "normalized": "يكتب", "start": 3, "end": 8, "root": ["ك","ت","ب"]}], "classification": {"type": "خبر", "strength": "معلّق"}}, "annotator": "manual", "notes": "خبر معلّق — قد للتقليل"},
  {"id": "gold_092", "text": "ربما كَتَبَ", "annotations": {"tokens": [{"text": "ربما", "normalized": "ربما", "start": 0, "end": 4}, {"text": "كَتَبَ", "normalized": "كتب", "start": 5, "end": 10, "root": ["ك","ت","ب"], "pattern": "فَعَلَ", "event_type": "ACTION"}], "classification": {"type": "خبر", "strength": "معلّق"}}, "annotator": "manual", "notes": "خبر معلّق — ربما للشك"},
  {"id": "gold_093", "text": "يا طالبُ اكتبْ", "annotations": {"tokens": [{"text": "يا", "normalized": "يا", "start": 0, "end": 2}, {"text": "طالبُ", "normalized": "طالب", "start": 3, "end": 8, "root": ["ط","ل","ب"]}, {"text": "اكتبْ", "normalized": "اكتب", "start": 9, "end": 14, "root": ["ك","ت","ب"]}], "classification": {"type": "إنشاء", "strength": "قطعي"}}, "annotator": "manual", "notes": "إنشاء — نداء + أمر"},
  {"id": "gold_094", "text": "لعلّ الطالبَ يكتبُ", "annotations": {"tokens": [{"text": "لعلّ", "normalized": "لعل", "start": 0, "end": 3}, {"text": "الطالبَ", "normalized": "الطالب", "start": 4, "end": 11, "root": ["ط","ل","ب"]}, {"text": "يكتبُ", "normalized": "يكتب", "start": 12, "end": 17, "root": ["ك","ت","ب"]}], "classification": {"type": "إنشاء", "strength": "قطعي"}}, "annotator": "manual", "notes": "إنشاء — ترجٍّ بلعلّ"},
  {"id": "gold_095", "text": "ليتَ الطالبَ كَتَبَ", "annotations": {"tokens": [{"text": "ليتَ", "normalized": "ليت", "start": 0, "end": 3}, {"text": "الطالبَ", "normalized": "الطالب", "start": 4, "end": 11, "root": ["ط","ل","ب"]}, {"text": "كَتَبَ", "normalized": "كتب", "start": 12, "end": 17, "root": ["ك","ت","ب"], "pattern": "فَعَلَ", "event_type": "ACTION"}], "classification": {"type": "إنشاء", "strength": "قطعي"}}, "annotator": "manual", "notes": "إنشاء — تمنٍّ بليت"}
]
